{
  "name": "graphic-design-motion",
  "description": "Design motion graphics and UI animations — microinteractions, transitions, Lottie, CSS animations — with explicit timing, easing, choreography, and performance rules.",
  "url": "https://github.com/quirk/example/blob/main/.agents/skills/graphic-design/graphic-design-motion/SKILL.md",
  "version": "1",
  "capabilities": {
    "skillInvocation": true,
    "artifactProduction": true,
    "workflowOrchestration": true
  },
  "authentication": {
    "schemes": [
      "none"
    ]
  },
  "skills": [
    {
      "id": "graphic-design/graphic-design-motion",
      "name": "graphic-design-motion",
      "description": "Design motion graphics and UI animations — microinteractions, transitions, Lottie, CSS animations — with explicit timing, easing, choreography, and performance rules.",
      "tags": [
        "\"graphic-design\""
      ],
      "parameters": {
        "modelTier": "reasoning",
        "artifactType": "plan"
      }
    }
  ]
}
