{
  "name": "tdd",
  "description": "Test-driven development. Use when the user wants to build features or fix bugs test-first, mentions \"red-green-refactor\"",
  "url": "https://github.com/quirk/example/blob/main/.agents/skills/delivery/tdd/SKILL.md",
  "version": "1",
  "capabilities": {
    "skillInvocation": true,
    "artifactProduction": true,
    "workflowOrchestration": true
  },
  "authentication": {
    "schemes": [
      "none"
    ]
  },
  "skills": [
    {
      "id": "delivery/tdd",
      "name": "tdd",
      "description": "Test-driven development. Use when the user wants to build features or fix bugs test-first, mentions \"red-green-refactor\"",
      "tags": [
        "tdd",
        "testing",
        "delivery",
        "implementation"
      ],
      "parameters": {
        "trustTier": "1",
        "modelTier": "code",
        "artifactType": "implementation"
      }
    }
  ]
}
