{
  "name": "mlops",
  "description": "MLOps (feature stores, model registry, data versioning, pipeline orchestration, monitoring, retraining)",
  "url": "https://github.com/quirk/example/blob/main/.agents/skills/ai/mlops/SKILL.md",
  "version": "1",
  "capabilities": {
    "skillInvocation": true,
    "artifactProduction": true,
    "workflowOrchestration": true
  },
  "authentication": {
    "schemes": [
      "none"
    ]
  },
  "skills": [
    {
      "id": "ai/mlops",
      "name": "mlops",
      "description": "MLOps (feature stores, model registry, data versioning, pipeline orchestration, monitoring, retraining)",
      "tags": [
        "\"ai\""
      ],
      "parameters": {
        "trustTier": "3",
        "modelTier": "reasoning",
        "artifactType": "ai"
      }
    }
  ]
}
