{
  "name": "secret-management",
  "description": "Design secret management — Vault, SOPS, SealedSecrets, rotation, external secrets — with encryption, access control, and auditability.",
  "url": "https://github.com/quirk/example/blob/main/.agents/skills/devops/secret-management/SKILL.md",
  "version": "1",
  "capabilities": {
    "skillInvocation": true,
    "artifactProduction": false,
    "workflowOrchestration": false
  },
  "authentication": {
    "schemes": [
      "none"
    ]
  },
  "skills": [
    {
      "id": "devops/secret-management",
      "name": "secret-management",
      "description": "Design secret management — Vault, SOPS, SealedSecrets, rotation, external secrets — with encryption, access control, and auditability.",
      "tags": [
        "devops"
      ],
      "parameters": {
        "trustTier": "3"
      }
    }
  ]
}
