{
  "name": "data-catalog",
  "description": "Data catalog (metadata management, discovery, classification, data mesh, governance).",
  "url": "https://github.com/quirk/example/blob/main/.agents/skills/data/data-catalog/SKILL.md",
  "version": "1",
  "capabilities": {
    "skillInvocation": true,
    "artifactProduction": true,
    "workflowOrchestration": true
  },
  "authentication": {
    "schemes": [
      "none"
    ]
  },
  "skills": [
    {
      "id": "data/data-catalog",
      "name": "data-catalog",
      "description": "Data catalog (metadata management, discovery, classification, data mesh, governance).",
      "tags": [
        "\"data\""
      ],
      "parameters": {
        "trustTier": "1",
        "modelTier": "reasoning",
        "artifactType": "data"
      }
    }
  ]
}
