{
  "name": "cost-optimization",
  "description": "Design FinOps strategies — rightsizing, spot instances, committed use, budgets, showback/chargeback — with cost visibility and optimisation guardrails.",
  "url": "https://github.com/quirk/example/blob/main/.agents/skills/devops/cost-optimization/SKILL.md",
  "version": "1",
  "capabilities": {
    "skillInvocation": true,
    "artifactProduction": false,
    "workflowOrchestration": false
  },
  "authentication": {
    "schemes": [
      "none"
    ]
  },
  "skills": [
    {
      "id": "devops/cost-optimization",
      "name": "cost-optimization",
      "description": "Design FinOps strategies — rightsizing, spot instances, committed use, budgets, showback/chargeback — with cost visibility and optimisation guardrails.",
      "tags": [
        "devops"
      ],
      "parameters": {
        "trustTier": "3"
      }
    }
  ]
}
