{
  "name": "gitops",
  "description": "Design GitOps workflows — ArgoCD, Flux, declarative sync, drift detection, progressive delivery — with explicit reconciliation and safety boundaries.",
  "url": "https://github.com/quirk/example/blob/main/.agents/skills/devops/gitops/SKILL.md",
  "version": "1",
  "capabilities": {
    "skillInvocation": true,
    "artifactProduction": true,
    "workflowOrchestration": true
  },
  "authentication": {
    "schemes": [
      "none"
    ]
  },
  "skills": [
    {
      "id": "devops/gitops",
      "name": "gitops",
      "description": "Design GitOps workflows — ArgoCD, Flux, declarative sync, drift detection, progressive delivery — with explicit reconciliation and safety boundaries.",
      "tags": [
        "\"devops\""
      ],
      "parameters": {
        "trustTier": "3",
        "modelTier": "reasoning",
        "artifactType": "devops"
      }
    }
  ]
}
