{
  "name": "graphic-design-data-viz",
  "description": "Design data visualizations — charts, infographics, dashboards — with explicit readability, accessibility, color, typography, and production rules.",
  "url": "https://github.com/quirk/example/blob/main/.agents/skills/graphic-design/graphic-design-data-viz/SKILL.md",
  "version": "1",
  "capabilities": {
    "skillInvocation": true,
    "artifactProduction": false,
    "workflowOrchestration": false
  },
  "authentication": {
    "schemes": [
      "none"
    ]
  },
  "skills": [
    {
      "id": "graphic-design/graphic-design-data-viz",
      "name": "graphic-design-data-viz",
      "description": "Design data visualizations — charts, infographics, dashboards — with explicit readability, accessibility, color, typography, and production rules.",
      "tags": [
        "graphic-design"
      ],
      "parameters": {}
    }
  ]
}
