{
  "name": "microservices",
  "description": "Design microservice architectures — service decomposition, inter-service communication, data ownership, resilience patterns — with explicit boundaries and failure isolation.",
  "url": "https://github.com/quirk/example/blob/main/.agents/skills/backend/microservices/SKILL.md",
  "version": "1",
  "capabilities": {
    "skillInvocation": true,
    "artifactProduction": false,
    "workflowOrchestration": false
  },
  "authentication": {
    "schemes": [
      "none"
    ]
  },
  "skills": [
    {
      "id": "backend/microservices",
      "name": "microservices",
      "description": "Design microservice architectures — service decomposition, inter-service communication, data ownership, resilience patterns — with explicit boundaries and failure isolation.",
      "tags": [
        "backend"
      ],
      "parameters": {
        "trustTier": "1"
      }
    }
  ]
}
