{
  "name": "physics-writing-revtex",
  "description": "Write physics papers using RevTeX / APS / IOP / AIP formatting, with figure conventions, citation styles, and submission package preparation.",
  "url": "https://github.com/quirk/example/blob/main/.agents/skills/physics/physics-writing-revtex/SKILL.md",
  "version": "1",
  "capabilities": {
    "skillInvocation": true,
    "artifactProduction": true,
    "workflowOrchestration": true
  },
  "authentication": {
    "schemes": [
      "none"
    ]
  },
  "skills": [
    {
      "id": "physics/physics-writing-revtex",
      "name": "physics-writing-revtex",
      "description": "Write physics papers using RevTeX / APS / IOP / AIP formatting, with figure conventions, citation styles, and submission package preparation.",
      "tags": [
        "\"physics\""
      ],
      "parameters": {
        "trustTier": "1",
        "modelTier": "reasoning",
        "artifactType": "physics"
      }
    }
  ]
}
