{
  "name": "design-system-visual",
  "description": "Design visual design systems — tokens, components, patterns, and documentation — with explicit hierarchy, accessibility, and cross-channel consistency.",
  "url": "https://github.com/quirk/example/blob/main/.agents/skills/graphic-design/design-system-visual/SKILL.md",
  "version": "1",
  "capabilities": {
    "skillInvocation": true,
    "artifactProduction": false,
    "workflowOrchestration": false
  },
  "authentication": {
    "schemes": [
      "none"
    ]
  },
  "skills": [
    {
      "id": "graphic-design/design-system-visual",
      "name": "design-system-visual",
      "description": "Design visual design systems — tokens, components, patterns, and documentation — with explicit hierarchy, accessibility, and cross-channel consistency.",
      "tags": [
        "graphic-design"
      ],
      "parameters": {
        "trustTier": "1"
      }
    }
  ]
}
