{
  "name": "setup-quirk-skills",
  "description": "Configure this repo for the engineering skills — set up its issue tracker, triage label vocabulary, and domain doc layout. Run once before first use of the other engineering skills.",
  "url": "https://github.com/quirk/example/blob/main/.agents/skills/auxiliary/setup-quirk-skills/SKILL.md",
  "version": "1",
  "capabilities": {
    "skillInvocation": true,
    "artifactProduction": false,
    "workflowOrchestration": false
  },
  "authentication": {
    "schemes": [
      "none"
    ]
  },
  "skills": [
    {
      "id": "auxiliary/setup-quirk-skills",
      "name": "setup-quirk-skills",
      "description": "Configure this repo for the engineering skills — set up its issue tracker, triage label vocabulary, and domain doc layout. Run once before first use of the other engineering skills.",
      "tags": [
        "auxiliary"
      ],
      "parameters": {
        "trustTier": "3"
      }
    }
  ]
}
